{
  "task_id": "TASK-20260314-001",
  "timestamp": "2026-03-14T15:04:26-03:00",
  "from": "executor",
  "to": "auditor",
  "branch": "main",
  "commit": "abc1234",
  "title": "Implementação da infraestrutura ai-bridge",
  "objective": "Criar a estrutura completa de comunicação entre Executor (Antigravity) e Auditor (GitHub AI) para permitir ciclos de auditoria rastreáveis e previsíveis.",
  "root_cause": "Não existia canal estruturado de comunicação entre os agentes de IA. Mudanças ocorriam sem auditoria formal.",
  "files_changed": [
    "ai-bridge/schemas/task.schema.json",
    "ai-bridge/schemas/review.schema.json",
    "ai-bridge/templates/task-template.json",
    "ai-bridge/templates/task-template.md",
    "ai-bridge/templates/review-template.json",
    "ai-bridge/templates/review-template.md",
    "ai-bridge/state/CURRENT_TASK.json",
    "ai-bridge/docs/bridge-protocol.md"
  ],
  "changes_summary": "Criação da infraestrutura ai-bridge completa incluindo schemas de validação JSON, templates para TASK e REVIEW em formato JSON e Markdown, arquivo de estado do ciclo, e documentação do protocolo de comunicação.",
  "validations_run": [
    "Validação de estrutura JSON dos schemas",
    "Verificação de campos obrigatórios nos templates",
    "Revisão da documentação do protocolo"
  ],
  "known_risks": [
    "Primeiro ciclo — não há histórico de uso real para validar o fluxo",
    "Auditor ainda precisa ser configurado para ler a pasta to-auditor"
  ],
  "audit_focus": "Valide se os schemas cobrem todos os campos necessários e se o fluxo documentado está claro e sem ambiguidades.",
  "status": "ready_for_audit"
}
