{
  "task_id": "TASK-20260314-002",
  "timestamp": "2026-03-14T15:29:22-03:00",
  "from": "executor",
  "to": "auditor",
  "branch": "main",
  "commit": "c0b4be1",
  "title": "Implementação da AI Bridge Test Page",
  "objective": "Criar uma página web de teste simples e visualmente limpa para validar o fluxo completo de comunicação entre Executor (Antigravity) e Auditor (GitHub AI) via ai-bridge. Esta é a primeira implementação real de código no projeto, servindo como prova de conceito do ciclo executor → auditor.",
  "root_cause": "Não existia nenhuma implementação de código no projeto para testar o fluxo de comunicação ai-bridge. Sem uma mudança real de código, não é possível validar se o ciclo de auditoria funciona corretamente.",
  "files_changed": [
    "web/index.html",
    "web/css/style.css",
    "web/js/main.js"
  ],
  "changes_summary": "Criação de uma página web estática composta por 3 arquivos: (1) index.html — estrutura semântica com header, flow indicator de 5 passos, 3 cards informativos (Executor, Auditor, State Control), botão CTA de validação e footer; (2) style.css — design system dark mode com variáveis CSS, gradientes, glow nos cards, animações de pulse, micro-interações de hover e layout responsivo para mobile/desktop; (3) main.js — JavaScript mínimo para animação sequencial do flow indicator e exibição do resultado de validação simulada ao clicar no botão.",
  "validations_run": [
    "Validação visual no navegador — página carregou corretamente",
    "Layout responsivo verificado — 3 cards em grid",
    "Botão CTA funcional — animação do flow indicator e resultado exibido",
    "Sem erros no console do navegador",
    "Sem dependências externas além do Google Fonts"
  ],
  "known_risks": [
    "Página é puramente estática — não valida integração com backend",
    "Google Fonts depende de conectividade para carregar a fonte Inter",
    "Flow indicator é simulação visual, não reflete estado real do ai-bridge"
  ],
  "audit_focus": "O Auditor deve verificar: (1) qualidade estrutural da página HTML — semântica e acessibilidade; (2) riscos de regressão — impacto em outras partes do projeto; (3) clareza da implementação — código legível e bem organizado; (4) problemas de layout — alinhamento, espaçamento, hierarquia visual; (5) problemas de responsividade — comportamento em telas pequenas; (6) organização do código — separação de concerns entre HTML/CSS/JS; (7) possíveis erros técnicos — bugs, edge cases, compatibilidade cross-browser.",
  "status": "ready_for_audit"
}
